<?xml version="1.0" encoding="UTF-8"?>
<Faction xmlns:xsi="http://www.w3.org/2001/XMLSchema-instance"
         xsi:noNamespaceSchemaLocation="../../../marxism/socially_determined_objects/Faction.xsd">
    <ID>F004</ID>
    <Name>People's Liberation Front</Name>
    <Description>Marxist-Leninist-Maoist organization emphasizing protracted people's war and mass line organizing among urban and rural poor.</Description>
    <Ideology>Marxism-Leninism-Maoism</Ideology>
    
    <ClassComposition>
        <Class>
            <ClassID>C001</ClassID>
            <Percentage>80</Percentage>
        </Class>
        <Class>
            <ClassID>C002</ClassID>
            <Percentage>15</Percentage>
        </Class>
        <Class>
            <ClassID>C003</ClassID>
            <Percentage>5</Percentage>
        </Class>
    </ClassComposition>
    
    <EconomicBase>
        <ModeOfProduction>Collective Communes</ModeOfProduction>
        <Resources>
            <Resource>
                <Type>Community Centers</Type>
                <Quantity>4000</Quantity>
            </Resource>
            <Resource>
                <Type>Agricultural Collectives</Type>
                <Quantity>5000</Quantity>
            </Resource>
        </Resources>
    </EconomicBase>
    
    <StrategicDoctrine>
        <PoliticalStrategy>Mass Line</PoliticalStrategy>
        <MilitaryStrategy>Protracted People's War</MilitaryStrategy>
    </StrategicDoctrine>
    
    <DialecticalRelationships>
        <Contradiction>
            <WithFactionID>F001</WithFactionID>
            <Nature>Antagonistic</Nature>
            <Intensity>Critical</Intensity>
        </Contradiction>
        <Contradiction>
            <WithFactionID>F003</WithFactionID>
            <Nature>Non-Antagonistic</Nature>
            <Intensity>Low</Intensity>
        </Contradiction>
    </DialecticalRelationships>
    
    <HistoricalDevelopment>Developed through urban-rural mass movements and community organizing among the most oppressed sections of society</HistoricalDevelopment>
    
    <Leader>
        <Name>Maria Santos</Name>
        <Background>Community organizer and guerrilla strategist</Background>
        <Traits>
            <Trait>Revolutionary</Trait>
            <Trait>Mass-oriented</Trait>
            <Trait>Strategic</Trait>
        </Traits>
    </Leader>
    
    <Influence>
        <Region>
            <Name>Urban Slums</Name>
            <ControlLevel>High</ControlLevel>
        </Region>
        <Region>
            <Name>Rural Areas</Name>
            <ControlLevel>Medium</ControlLevel>
        </Region>
    </Influence>
    
    <Military>
        <Strength>6000</Strength>
        <Units>
            <Unit>
                <Name>People's Guerrilla Army</Name>
                <Type>Guerrilla</Type>
                <Strength>6000</Strength>
            </Unit>
        </Units>
    </Military>
    
    <Attributes>
        <Attribute>
            <Name>PopularSupport</Name>
            <Value>15</Value>
        </Attribute>
        <Attribute>
            <Name>MassOrganization</Name>
            <Value>High</Value>
        </Attribute>
    </Attributes>
</Faction>
